{
  "schema_version": "release-report-v1",
  "run_id": "run-20260714T043039Z",
  "generated_at": "2026-07-14T04:30:39.593308+00:00",
  "repository": "[REPO_ROOT]",
  "overall_status": "pass",
  "summary": {
    "pass": 17,
    "fail": 0,
    "pending": 0,
    "total": 17
  },
  "gates": [
    {
      "name": "contracts",
      "status": "pass",
      "summary": "17 schemas and canonical fixture validated",
      "evidence": [
        {
          "schema": "assistance-result.schema.json",
          "sha256": "19670765542706a47147c6818342498556ace2ec196eb3dfa48da1ba9ec0503f"
        },
        {
          "schema": "misconception-dossier.schema.json",
          "sha256": "755ee68b2a2273fb468c013d6df6b6b2ff002454e7f41570c43d2580d162a27d"
        },
        {
          "schema": "release_report.schema.json",
          "sha256": "febdfa875d92732857cc05c34bd2fcb350251bed9fb0e523e7aa73993845d23d"
        },
        {
          "schema": "representative_case.schema.json",
          "sha256": "f0ca8d39488a97feb7920de019c858f2563269f95779ba7d5021bf80c4334ebc"
        },
        {
          "schema": "review-schedule.schema.json",
          "sha256": "55add0f30765a6978a0fc6d45a88106eeecfc9247fb21b8a4b2fa5a21f84ce14"
        },
        {
          "schema": "source-document.schema.json",
          "sha256": "9186688125c0231ba84afef2d38359101fb260bf6cba16803b1b9f7ed17b895c"
        },
        {
          "schema": "source-span.schema.json",
          "sha256": "8c7a8228d28a958f3cf38e21bd910865bbec6e2bb9af3f53b921f23ad3eb201a"
        },
        {
          "schema": "study-artifact-content.schema.json",
          "sha256": "5a02c854feae2af0707291496b197a68fd88807612e1f59bdeb6027e3b82b8b7"
        },
        {
          "schema": "study-artifact.schema.json",
          "sha256": "995ddc79f3470bb25d74c0f68f7e08dc6f6f98c8acbea12bf80183045dc88fcf"
        },
        {
          "schema": "study-candidate-skill-link.schema.json",
          "sha256": "ef27481829c2e06bd340d70728f43c15d967184f4e326e0583dc337701c7b39f"
        },
        {
          "schema": "study-pack-attempt-result.schema.json",
          "sha256": "e7ce725aa4b6a2e4a2294cc652162373029e0af5609a761ae2a0126de544c325"
        },
        {
          "schema": "study-pack-attempt.schema.json",
          "sha256": "692364ff695deb953b14cfe87268f9d217468ec0fca6f758105517f86068fc89"
        },
        {
          "schema": "study-pack-detail.schema.json",
          "sha256": "8e45e31ab241dde2c71455f19b6e0c5df0cc030370ec0a26d68b6209f0741004"
        },
        {
          "schema": "study-pack.schema.json",
          "sha256": "12d895749c5b4dba84a58cdbddaed451c3353176be094db51969f0b8fd03162c"
        },
        {
          "schema": "study-verifier-decision.schema.json",
          "sha256": "eceafa2c86ee0eeddd30f97e1383b94690344600ccdb4a3a8e537659ce236c5d"
        },
        {
          "schema": "today-plan.schema.json",
          "sha256": "d8794de9b545847a55a2ea7afc659ef5ee8adbd4e66608cad5bd87174100f1f4"
        },
        {
          "schema": "trajectory.schema.json",
          "sha256": "aeea1d26690a31ab67b7cf9d08d19b8540f58f4f04a7764e4b2adc3665744730"
        }
      ],
      "blocking": true,
      "duration_ms": 3
    },
    {
      "name": "fixtures",
      "status": "pass",
      "summary": "42/42 domain fixtures resolve and cover every required path/mode exactly once",
      "evidence": [
        {
          "valid_fixture_count": 42,
          "unique_fixture_ids": 42,
          "required_case_count": 42
        },
        {
          "present": [
            [
              "interview",
              "comprehensive_analysis",
              "ambiguous"
            ],
            [
              "interview",
              "comprehensive_analysis",
              "offline"
            ],
            [
              "interview",
              "comprehensive_analysis",
              "success"
            ],
            [
              "interview",
              "emergency",
              "ambiguous"
            ],
            [
              "interview",
              "emergency",
              "offline"
            ],
            [
              "interview",
              "emergency",
              "success"
            ],
            [
              "interview",
              "interpersonal",
              "ambiguous"
            ],
            [
              "interview",
              "interpersonal",
              "offline"
            ],
            [
              "interview",
              "interpersonal",
              "success"
            ],
            [
              "interview",
              "organization",
              "ambiguous"
            ],
            [
              "interview",
              "organization",
              "offline"
            ],
            [
              "interview",
              "organization",
              "success"
            ],
            [
              "shenlun",
              "comprehensive_analysis",
              "ambiguous"
            ],
            [
              "shenlun",
              "comprehensive_analysis",
              "offline"
            ],
            [
              "shenlun",
              "comprehensive_analysis",
              "success"
            ],
            [
              "shenlun",
              "essay",
              "ambiguous"
            ],
            [
              "shenlun",
              "essay",
              "offline"
            ],
            [
              "shenlun",
              "essay",
              "success"
            ],
            [
              "shenlun",
              "official_writing",
              "ambiguous"
            ],
            [
              "shenlun",
              "official_writing",
              "offline"
            ],
            [
              "shenlun",
              "official_writing",
              "success"
            ],
            [
              "shenlun",
              "recommendation",
              "ambiguous"
            ],
            [
              "shenlun",
              "recommendation",
              "offline"
            ],
            [
              "shenlun",
              "recommendation",
              "success"
            ],
            [
              "shenlun",
              "summary",
              "ambiguous"
            ],
            [
              "shenlun",
              "summary",
              "offline"
            ],
            [
              "shenlun",
              "summary",
              "success"
            ],
            [
              "xingce",
              "common_political_knowledge",
              "ambiguous"
            ],
            [
              "xingce",
              "common_political_knowledge",
              "offline"
            ],
            [
              "xingce",
              "common_political_knowledge",
              "success"
            ],
            [
              "xingce",
              "data_analysis",
              "ambiguous"
            ],
            [
              "xingce",
              "data_analysis",
              "offline"
            ],
            [
              "xingce",
              "data_analysis",
              "success"
            ],
            [
              "xingce",
              "judgment",
              "ambiguous"
            ],
            [
              "xingce",
              "judgment",
              "offline"
            ],
            [
              "xingce",
              "judgment",
              "success"
            ],
            [
              "xingce",
              "quantitative",
              "ambiguous"
            ],
            [
              "xingce",
              "quantitative",
              "offline"
            ],
            [
              "xingce",
              "quantitative",
              "success"
            ],
            [
              "xingce",
              "verbal",
              "ambiguous"
            ],
            [
              "xingce",
              "verbal",
              "offline"
            ],
            [
              "xingce",
              "verbal",
              "success"
            ]
          ]
        },
        {
          "missing": []
        },
        {
          "extra": [],
          "duplicate_fixture_ids": []
        },
        {
          "fixtures": [
            {
              "fixture": "domains/fixtures/interview/comprehensive_ai_service.json",
              "fixture_id": "interview.comprehensive.ai-service.synthetic-01",
              "resolved_sha256": "d2a670e3b0c3e16c82074b3101af8231ed075c695ff65fe73b31bf938fe52fb6"
            },
            {
              "fixture": "domains/fixtures/interview/comprehensive_ai_service_ambiguous.json",
              "fixture_id": "interview.comprehensive.ai-service.ambiguous-01",
              "resolved_sha256": "2b747f4747d5acf96c5405c2d2000cb21b159f91b5997e04ec17b7c1daae1888"
            },
            {
              "fixture": "domains/fixtures/interview/comprehensive_ai_service_offline.json",
              "fixture_id": "interview.comprehensive.ai-service.offline-01",
              "resolved_sha256": "cdaf5f9c1ee4ca005e87e1c8db98f0ad98bb0ad1215ad1fe095ecf49df4a871b"
            },
            {
              "fixture": "domains/fixtures/interview/emergency_power_outage.json",
              "fixture_id": "interview.emergency.power-outage.synthetic-01",
              "resolved_sha256": "24cc405d560e7db69019a49179ac1da2aa8321b5339fcff4c20093c21fa15559"
            },
            {
              "fixture": "domains/fixtures/interview/emergency_power_outage_ambiguous.json",
              "fixture_id": "interview.emergency.power-outage.ambiguous-01",
              "resolved_sha256": "682399f4bc34ad37055ee06c308a3cc6a724ab919a48b5c3289f76104fdbd8a0"
            },
            {
              "fixture": "domains/fixtures/interview/emergency_power_outage_offline.json",